{
  "$schema": "../../../schema/scene.schema.json",
  "version": 1,
  "dialogue": "council.dialogue.txt",
  "cuts": [
    {
      "id": "council",
      "label": "01 / THE COUNCIL",
      "polygon": [
        [-635, -15],
        [300, -15],
        [300, -371],
        [-635, -371]
      ],
      "fill": "dark",
      "floor_y": -285,
      "walk": [-608, 297],
      "children": [
        { "type": "shape", "id": "glow", "pos": [-169, -193], "z": 0, "shape": "vignette", "size": [932, 356], "color": "#120f0c", "alpha": 0.67, "pulse": 0.1 },
        { "type": "shape", "id": "floor_line", "pos": [-165, -285], "z": 0.5, "shape": "rect", "size": [530, 2], "color": "ink", "alpha": 0.6 },
        { "type": "sprite", "id": "table", "pos": [-153, -238], "z": 1, "size": [180, 90], "frames": ["table:0"], "mode": "hold" },
        { "type": "sprite", "id": "candle", "pos": [-147, -153], "z": 2, "size": [40, 80], "frames": ["candle:0", "candle:1"] },
        { "type": "sprite", "id": "elder", "pos": [-310, -224], "z": 2, "size": [142, 142], "frames": ["elder:0"] },
        { "type": "sprite", "id": "scout", "pos": [8, -224], "z": 2, "size": [142, 142], "frames": ["mouse:0", "mouse:1"], "flip": true, "tint": "#9e9485" }
      ]
    },
    {
      "id": "elder_closeup",
      "label": "02 / THE ELDER",
      "polygon": [
        [-635, 206],
        [-240, 206],
        [-139, 27],
        [-635, 27]
      ],
      "fill": "dark",
      "children": [
        { "type": "sprite", "id": "elder_big", "pos": [-635, 74], "z": 2, "size": [260, 260], "frames": ["elder:0"] },
        { "type": "balloon", "id": "b_elder_1", "pos": [-403, 215], "size": [265, 83], "tail": [-198, -190], "kind": "speech", "line": "elder.1", "clip": false },
        { "type": "balloon", "id": "b_elder_2", "pos": [-297, 58], "size": [262, 117], "tail": [-252, 72], "kind": "speech", "line": "elder.2", "clip": false }
      ],
      "initially": "hidden"
    },
    {
      "id": "scout_closeup",
      "label": "03 / THE SCOUT",
      "polygon": [
        [-693, -396],
        [-213, -396],
        [-213, -1036],
        [-693, -1036]
      ],
      "fill": "dark",
      "children": [
        { "type": "sprite", "id": "scout_big", "pos": [-453, -866], "z": 2, "size": [260, 260], "frames": ["mouse:0", "mouse:1"], "flip": true, "tint": "#9e9485" },
        { "type": "balloon", "id": "b_scout_1", "pos": [-453, -506], "size": [374, 140], "tail": [-70, -320], "kind": "speech", "line": "scout.1", "clip": false },
        { "type": "balloon", "id": "b_scout_2", "pos": [-453, -661], "size": [374, 140], "tail": [-70, -165], "kind": "speech", "line": "scout.2", "clip": false }
      ],
      "initially": "hidden"
    },
    {
      "id": "door",
      "label": "04 / THE DOOR",
      "polygon": [
        [738, 332],
        [1308, 332],
        [1308, -428],
        [738, -428]
      ],
      "fill": "dark",
      "floor_y": -306,
      "walk": [812, 1234],
      "children": [
        { "type": "text", "id": "tbc", "pos": [1023, -86], "z": 1, "text": "TO BE CONTINUED", "size": 22, "color": "paper" }
      ]
    },
    {
      "id": "cut_5",
      "polygon": [
        [-200, 206],
        [-109, 27],
        [300, 27],
        [300, 206]
      ],
      "fill": "dark",
      "children": [
        { "type": "balloon", "id": "balloon", "pos": [-116, 153], "z": 5, "size": [243, 94], "tail": [182, 21], "kind": "speech", "line": "", "clip": false },
        { "type": "balloon", "id": "balloon_2", "pos": [255, 69], "z": 5, "size": [320, 130], "tail": [-61, 90], "kind": "thought", "line": "", "clip": false }
      ],
      "initially": "hidden"
    }
  ],
  "player": {
    "cut": "council",
    "x": -510,
    "size": [142, 142],
    "frames": { "idle": "hero:0", "walk": ["hero:2", "hero:3", "hero:4", "hero:5"], "jump": "hero:7" },
    "clip": true
  },
  "flow": [
    {
      "on": "z",
      "steps": [
        { "focus": "elder_closeup" },
        { "say": "b_elder_1" },
        { "focus": "cut_5" },
        { "say": "balloon" },
        { "focus": "elder_closeup" },
        { "say": "b_elder_2" },
        { "focus": "cut_5" },
        { "say": "balloon_2" },
        { "focus": "council" }
      ],
      "target": "elder",
      "range": 80
    }
  ]
}
